{
  "$schema": "https://json-schema.org/draft/2020-12/schema",
  "type": "object",
  "additionalProperties": false,
  "required": ["schema_version", "task_id", "criteria", "overall_preference", "material_fidelity_issue_in_a", "material_fidelity_issue_in_b", "rationale"],
  "properties": {
    "schema_version": {"const": "skill-canary-judge-1.0"},
    "task_id": {"type": "string", "pattern": "^(OM|IS|OR|XD)-[CSF][0-9]{2}$"},
    "criteria": {
      "type": "object",
      "additionalProperties": false,
      "required": ["usability", "model_fidelity", "managerial_clarity", "prose_economy"],
      "properties": {
        "usability": {"enum": ["A better", "B better", "tie"]},
        "model_fidelity": {"enum": ["A better", "B better", "tie"]},
        "managerial_clarity": {"enum": ["A better", "B better", "tie"]},
        "prose_economy": {"enum": ["A better", "B better", "tie"]}
      }
    },
    "overall_preference": {"enum": ["A better", "B better", "tie"]},
    "material_fidelity_issue_in_a": {"type": "boolean"},
    "material_fidelity_issue_in_b": {"type": "boolean"},
    "rationale": {"type": "string", "minLength": 1, "maxLength": 800}
  }
}
