{
  "schema_version": "skill-canary-judge-1.0",
  "task_id": "OM-S02",
  "criteria": {"usability": "A better", "model_fidelity": "tie", "managerial_clarity": "B better", "prose_economy": "A better"},
  "overall_preference": "A better",
  "material_fidelity_issue_in_a": false,
  "material_fidelity_issue_in_b": false,
  "rationale": "Both correctly restore the sequence—staffing first, uncertain demand second, fulfillment as an outcome—and avoid unsupported empirical claims. B offers slightly clearer managerial scaffolding and explicitly marks unspecified model elements, but its readiness rubric, gate table, and repeated role summary are excessive for the requested concise repair. A delivers the same essential diagnosis and a directly reusable replacement with less overhead. Neither has a material fidelity defect."
}
